{
  "$schema": "./kokuen.components.schema.json",
  "version": "5.0.0",
  "description": "Candidate KOKUEN v5 universal component contracts. Promote a record to stable only after code, Figma, and fixture proof are complete.",
  "defaults": {
    "minimumTarget": "44px",
    "contentVisibleByDefault": true,
    "colorOnlyStateAllowed": false,
    "hoverMovementAllowed": false,
    "layoutSpacing": ["0px", "4px", "8px", "12px", "16px", "24px", "32px", "48px", "64px"]
  },
  "components": [
    {
      "id": "action.button",
      "status": "candidate",
      "userJob": "Commit one clearly named action.",
      "code": { "path": "kokuen.css", "api": [".k-button", ".k-button--primary", ".k-button--quiet", ".k-button--danger"] },
      "figma": { "status": "planned", "componentKey": null, "propertyMapping": { "Hierarchy": "variant", "State": "state", "Icon": "icon" } },
      "anatomy": ["44px target", "label", "optional bare icon", "optional busy indicator"],
      "variants": ["primary", "quiet", "destructive"],
      "states": ["default", "hover", "focus-visible", "pressed", "busy", "disabled", "error"],
      "tokens": ["size.target", "space.control.inline", "space.control.gap", "button.primary.background", "button.primary.label", "color.focus"],
      "boundary": { "job": "input affordance for primary/destructive; state only for quiet", "rationale": "One target edge communicates action ownership; quiet actions omit a resting edge.", "restingOwner": "button", "focusOwner": "button", "widthBehavior": "content by default; full row only for a documented narrow or task-wide action" },
      "accessibility": { "role": "button", "name": "visible outcome label or explicit accessible name", "description": "consequence or shortcut only when needed", "state": "disabled and busy exposed", "errorRelationship": "failure message associated with affected region" },
      "keyboard": { "keys": ["Enter", "Space"], "focusEntry": "Tab", "focusExit": "Tab", "focusReturn": "remains unless an opened layer defines return" },
      "behavior": { "pointer": "press and release inside activates", "touch": "44px target with no hover dependency", "disabled": "rejects activation", "loading": "keeps outcome label and exposes busy state", "repeatActivation": "rejected while busy" },
      "content": { "limits": "direct verb plus outcome", "localization": "allows wrap without fixed height", "overflow": "no silent truncation of the action outcome" },
      "responsive": { "density": "target remains 44px", "reflow": "content width unless the task requires full width" },
      "dataStates": ["idle", "pending", "success", "error"],
      "fixtures": ["fixture-button-states", "fixture-button-busy", "fixture-button-cjk"],
      "exceptions": []
    },
    {
      "id": "action.icon",
      "status": "candidate",
      "userJob": "Invoke a familiar compact action without losing target size or meaning.",
      "code": { "path": "kokuen.css", "api": [".k-icon-button"] },
      "figma": { "status": "planned", "componentKey": null, "propertyMapping": { "State": "state", "Icon": "icon" } },
      "anatomy": ["44px target", "16 to 20px bare mark", "accessible name"],
      "variants": ["quiet", "destructive"],
      "states": ["default", "hover", "focus-visible", "pressed", "busy", "disabled"],
      "tokens": ["size.target", "color.text.primary", "color.focus"],
      "boundary": { "job": "state", "rationale": "The mark is bare at rest; target and focus geometry provide interaction state.", "restingOwner": "none for quiet; button for destructive when required", "focusOwner": "44px button target", "widthBehavior": "fixed 44px target" },
      "accessibility": { "role": "button", "name": "explicit accessible action name", "description": "tooltip supplements but never names alone", "state": "disabled and busy exposed", "errorRelationship": "near affected work" },
      "keyboard": { "keys": ["Enter", "Space", "Escape when tooltip is open"], "focusEntry": "Tab", "focusExit": "Tab", "focusReturn": "remains on action" },
      "behavior": { "pointer": "whole target activates", "touch": "whole 44px target activates", "disabled": "rejects activation", "loading": "mark remains understandable", "repeatActivation": "rejected while busy" },
      "content": { "limits": "one action", "localization": "accessible name localizes independently", "overflow": "not applicable" },
      "responsive": { "density": "target unchanged", "reflow": "stays with the object it affects" },
      "dataStates": ["idle", "pending", "error"],
      "fixtures": ["fixture-icon-action", "fixture-target-measurement"],
      "exceptions": []
    },
    {
      "id": "field.text",
      "status": "candidate",
      "userJob": "Enter or edit a single-line value with clear label, help, and recovery.",
      "code": { "path": "kokuen.css", "api": [".k-field", ".k-field-shell", ".k-field-action"] },
      "figma": { "status": "planned", "componentKey": null, "propertyMapping": { "State": "state", "Prefix": "prefix", "Action": "action" } },
      "anatomy": ["label", "optional format", "field or composite shell", "optional proximal action", "hint or error"],
      "variants": ["plain", "search", "password", "prefix", "suffix", "read-only"],
      "states": ["empty", "placeholder", "filled", "focus-visible", "invalid", "disabled", "read-only", "autofill"],
      "tokens": ["field.height", "field.paddingInline", "field.background", "field.text", "field.edge", "field.focus"],
      "boundary": { "job": "input affordance and focus state", "rationale": "The input or composite shell owns one field edge; child controls never add another resting bezel.", "restingOwner": "input for plain field; shell for composite", "focusOwner": "same owner through focus-visible or focus-within", "widthBehavior": "bounded by expected value; full row only for search or true full-row entry" },
      "accessibility": { "role": "textbox or native input type", "name": "programmatic visible label", "description": "hint and format IDs", "state": "required, invalid, disabled, read-only", "errorRelationship": "aria-describedby references recovery message" },
      "keyboard": { "keys": ["native editing keys", "Escape only for a documented clear or search policy"], "focusEntry": "Tab", "focusExit": "Tab", "focusReturn": "field action returns focus to field when it changes the value" },
      "behavior": { "pointer": "click positions caret; label focuses field", "touch": "44px minimum field and action targets", "disabled": "unavailable and not editable", "loading": "separate from disabled", "repeatActivation": "not applicable" },
      "content": { "limits": "single-line intent", "localization": "label and recovery wrap; IME preserved", "overflow": "value scrolls natively; essential label is not clipped" },
      "responsive": { "density": "44px target retained", "reflow": "proximal action remains attached at narrow width and zoom" },
      "dataStates": ["empty", "filled", "invalid", "unavailable"],
      "fixtures": ["fixture-field-default", "fixture-field-composite", "fixture-field-error", "fixture-field-cjk"],
      "exceptions": []
    },
    {
      "id": "field.textarea",
      "status": "candidate",
      "userJob": "Compose and edit multiline content.",
      "code": { "path": "kokuen.css", "api": [".k-textarea"] },
      "figma": { "status": "planned", "componentKey": null, "propertyMapping": { "State": "state", "Resize": "resize" } },
      "anatomy": ["label", "textarea", "optional count", "hint or error"],
      "variants": ["resizable", "auto-growing", "read-only"],
      "states": ["empty", "filled", "focus-visible", "invalid", "disabled", "read-only"],
      "tokens": ["field.paddingInline", "field.background", "field.text", "field.edge", "field.focus", "font.lineHeight.body"],
      "boundary": { "job": "input affordance and focus state", "rationale": "One textarea edge contains the multiline editing region.", "restingOwner": "textarea", "focusOwner": "textarea", "widthBehavior": "bounded or composition width based on task" },
      "accessibility": { "role": "textbox with multiline semantics", "name": "programmatic visible label", "description": "hint, count, and error as applicable", "state": "invalid, disabled, read-only", "errorRelationship": "aria-describedby" },
      "keyboard": { "keys": ["native multiline editing", "Tab policy documented for code editors"], "focusEntry": "Tab", "focusExit": "Tab", "focusReturn": "not applicable" },
      "behavior": { "pointer": "native selection and resize", "touch": "minimum visible height supports touch", "disabled": "not editable", "loading": "not represented as disabled", "repeatActivation": "not applicable" },
      "content": { "limits": "multiline intent", "localization": "CJK and IME tested", "overflow": "grows or scrolls without clipping focus or text" },
      "responsive": { "density": "line height remains readable", "reflow": "fills bounded composition region" },
      "dataStates": ["empty", "filled", "invalid"],
      "fixtures": ["fixture-textarea", "fixture-textarea-cjk"],
      "exceptions": []
    },
    {
      "id": "choice.checkbox",
      "status": "candidate",
      "userJob": "Select zero or more independent options.",
      "code": { "path": "kokuen.css", "api": [".k-checkbox"] },
      "figma": { "status": "planned", "componentKey": null, "propertyMapping": { "State": "state", "Checked": "checked", "Indeterminate": "indeterminate" } },
      "anatomy": ["44px labelled target", "check mark", "label", "optional description"],
      "variants": ["standard", "indeterminate"],
      "states": ["unchecked", "checked", "indeterminate", "hover", "focus-visible", "pressed", "disabled", "invalid"],
      "tokens": ["size.target", "color.edge.interactive", "color.selection.background", "color.focus"],